{
  "task_id": "task_13_page_map_to_business_flow",
  "task_name": "Page Map 到业务流程",
  "mode": "fixed_prompt",
  "level": "custom",
  "status": "completed",
  "tool_profile_ref": "tool:demo_web",
  "started_at": "2026-07-04T11:10:00Z",
  "completed_at": "2026-07-04T11:18:00Z",
  "duration_minutes": 8,
  "operator": {
    "operator_id": "operator:demo_low_exp",
    "experience_level": "low",
    "role": "demo_operator"
  },
  "input_artifacts": [
    {
      "artifact_id": "dataset:generic_procurement_contract_mvp.web_snapshots",
      "artifact_type": "other",
      "path": "datasets/generic_procurement_contract_mvp/web_snapshots/",
      "description": "Optional C-stage offline HTML snapshots."
    },
    {
      "artifact_id": "dataset:generic_procurement_contract_mvp.page_map",
      "artifact_type": "other",
      "path": "datasets/generic_procurement_contract_mvp/web_map/page_map.json",
      "description": "Optional C-stage Web page map."
    },
    {
      "artifact_id": "prompt:task_13_page_map_to_business_flow",
      "artifact_type": "prompt",
      "path": "prompts/tasks/task_13_page_map_to_business_flow.md",
      "description": "Page map flow analysis prompt."
    }
  ],
  "output_artifacts": [
    {
      "artifact_id": "artifact:task_13_page_map_to_business_flow.report",
      "artifact_type": "report",
      "path": "normalized_outputs/task_13_page_map_to_business_flow.json",
      "description": "Simulated page map flow analysis output."
    },
    {
      "artifact_id": "artifact:task_13_page_map_to_business_flow.raw",
      "artifact_type": "raw_output",
      "path": "raw_outputs/task_13_page_map_to_business_flow_raw.md",
      "description": "Simulated raw AI response."
    }
  ],
  "evidence_refs": [
    "web:flow.home_to_purchase_requests",
    "web:flow.purchase_request_to_contract",
    "web:flow.contract_to_invoice",
    "web:flow.invoice_to_payment",
    "web:page_map.missing_pages"
  ],
  "schema_validation": {
    "is_valid": true,
    "schema_name": "task_result.schema.json",
    "validator": "demo_manual_check",
    "errors": []
  },
  "human_interventions": [
    {
      "intervention_type": "manual_fix",
      "description": "Operator normalized the simulated AI response into schema-compatible JSON for demo purposes.",
      "occurred_at": "2026-07-04T11:18:00Z",
      "operator_id": "operator:demo_low_exp"
    }
  ],
  "limitations": [
    "Demo sample, not a real tool run.",
    "Page flows are static snapshot navigation candidates, not live crawl results."
  ],
  "metrics": {
    "prompt_retry_count": 0,
    "manual_edit_minutes": 5,
    "navigation_edge_count": 4,
    "missing_page_count": 3
  },
  "notes": "Simulated Web snapshot task result for demonstrating optional C-stage Web scoring flow.",
  "provenance": {
    "created_by": "demo_web_generator",
    "created_at": "2026-07-04T11:10:00Z",
    "method": "hybrid",
    "source_system": "generic_procurement_contract_mvp",
    "tool_profile_ref": "tool:demo_web",
    "prompt_ref": "task_13_page_map_to_business_flow",
    "version": "demo-sample"
  }
}
